Fecha,Plataforma,Provincia,Localidad,Oferta_Empleo,Salario,Modalidad,Tipo_Contrato,Tipo_Jornada,Experiencia,Empresa,Requisitos
2025-09-21,Randstad,Gerona,Maçanet de la Selva,Operario/a preparapedidos o carretilla,"9,70-12 €/hora",Sin data,Sin Data,Sin Data,Sin Data,Randstad,Sin Data
2025-09-21,Randstad,Gerona,Maçanet de la Selva,Operario/a de picking,"9,60-10,50 €/hora",Sin data,Sin Data,Sin Data,Sin Data,Randstad,Sin Data
2025-09-21,Randstad,Gerona,Maçanet de la Selva,Auxiliar de envasado,"9,50-10,50 €/hora",Sin data,Sin Data,Sin Data,Sin Data,Randstad,Sin Data
2025-09-21,Randstad,Barcelona,Argentona,Operario u operaria en turno rotativo inicio lunes 22,"9,67 €/hora",Sin data,Sin Data,Sin Data,Sin Data,Randstad,Sin Data
2025-09-21,Randstad,Zaragoza,Utebo,Operario producción linea farmacia (envasado de producto),10-11 €/hora,Sin data,Sin Data,Sin Data,Sin Data,Randstad,Sin Data
