Fecha,Plataforma,Provincia,Localidad,Oferta_Empleo,Salario,Modalidad,Tipo_Contrato,Tipo_Jornada,Experiencia,Empresa,Requisitos
2025-11-07,Randstad,Barcelona,Terrassa,Tecnico/a de Mantenimiento Robotico Industrial,27.000-33.000 €/año,Sin data,Sin Data,Sin Data,Sin Data,Randstad rpo,Sin Data
2025-11-07,Randstad,Barcelona,Terrassa,Tecnico/a de Mantenimiento Electrico Industrial,27.000-33.000 €/año,Sin data,Sin Data,Sin Data,Sin Data,Randstad rpo,Sin Data
2025-11-07,Randstad,Barcelona,Hospitalet de Llobregat (L'),Tecnico/a de Mantenimiento Robotico Industrial,27.000-33.000 €/año,Sin data,Sin Data,Sin Data,Sin Data,Randstad rpo,Sin Data
2025-11-07,Randstad,Barcelona,Badalona,Tecnico/a de Mantenimiento Mecanico Industrial,27.000-33.000 €/año,Sin data,Sin Data,Sin Data,Sin Data,Randstad rpo,Sin Data
2025-11-07,Randstad,Barcelona,Hospitalet de Llobregat (L'),Operador robotico de mantenimiento,27.000-33.000 €/año,Sin data,Sin Data,Sin Data,Sin Data,Randstad rpo,Sin Data
2025-11-07,Randstad,Barcelona,Castelldefels,Tecnico/a de Mantenimiento Electrico Industrial,27.000-33.000 €/año,Sin data,Sin Data,Sin Data,Sin Data,Randstad rpo,Sin Data
2025-11-07,Randstad,Barcelona,Hospitalet de Llobregat (L'),Tecnico/a de Mantenimiento Mecanico Industrial,27.000-33.000 €/año,Sin data,Sin Data,Sin Data,Sin Data,Randstad rpo,Sin Data
2025-11-07,Randstad,Barcelona,Gavà,Atención al Cliente - Sector Farma,"10,16 €/hora",Sin data,Sin Data,Sin Data,Sin Data,Randstad,Sin Data
2025-11-07,Randstad,Barcelona,Barcelona,Teleoperador/a Comercial - Horario Tarde,"12,37 €/hora",Sin data,Sin Data,Sin Data,Sin Data,Randstad,Sin Data
2025-11-07,Randstad,Cáceres,Cáceres,Carretillero o carretillera sector automoción para Horse Valladolid,20.040-25.800 €/año,Sin data,Sin Data,Sin Data,Sin Data,Randstad rpo,Sin Data
2025-11-07,Randstad,Barcelona,Prat de Llobregat (El),Gestor Telefónico - Venta Cruzada,16.576 €/año,Sin data,Sin Data,Sin Data,Sin Data,Randstad,Sin Data
2025-11-07,Randstad,Barcelona,Badalona,Tecnico/a de Mantenimiento Robotico Industrial,27.000-33.000 €/año,Sin data,Sin Data,Sin Data,Sin Data,Randstad rpo,Sin Data
2025-11-07,Randstad,Barcelona,Barcelona,Teleoperador/a Fidelización - Renting Tecnológico,17.800 €/año,Sin data,Sin Data,Sin Data,Sin Data,Randstad,Sin Data
2025-11-07,Randstad,Barcelona,Barcelona,Teleoperador/a Atención al Cliente Sector Energético.,17.000 €/año,Sin data,Sin Data,Sin Data,Sin Data,Randstad,Sin Data
2025-11-07,Randstad,Barcelona,Barcelona,Atención al Cliente telefónico Sector Energético.,17.000 €/año,Sin data,Sin Data,Sin Data,Sin Data,Randstad,Sin Data
2025-11-07,Randstad,Barcelona,Sabadell,Tecnico/a de Mantenimiento Mecanico Industrial,27.000-33.000 €/año,Sin data,Sin Data,Sin Data,Sin Data,Randstad rpo,Sin Data
